{"schema_version":"1.0","name":"files","provider":"local","version":"1","description":"Read files","operations":[{"id":"write","input_schema":{"type":"object","properties":{}},"read":true,"write":true,"network":false,"secret_access":false,"destructive":false,"allowed_paths":["src"],"allowed_hosts":[],"timeout_seconds":1,"max_output_bytes":1,"approval":"conditional","approval_rule_ref":"policy://approval/v1","provenance_required":false}],"extensions":{"note":"informative"}}
